{
  "$schema": "http://json-schema.org/draft-07/schema#",
  "$id": "https://winlean.local/schemas/rule.schema.json",
  "title": "WinLean rule",
  "description": "A reviewed, declarative WinLean optimization rule. The authoritative validator is src/WinLean.Validation.psm1; this schema provides editor support.",
  "type": "object",
  "additionalProperties": false,
  "required": [
    "schemaVersion", "id", "name", "category", "description", "rationale", "risk", "reversible",
    "requiresReboot", "takesEffect", "windows", "conditions", "dependencies", "conflicts",
    "effects", "sideEffects", "benefit", "references", "resources"
  ],
  "anyOf": [
    { "properties": { "references": { "minItems": 1 } } },
    { "required": ["evidence"], "properties": { "evidence": { "minItems": 1 } } }
  ],
  "properties": {
    "$schema": { "type": "string" },
    "schemaVersion": { "const": 1 },
    "id": {
      "description": "Lowercase dotted identifier. The first segment is the category prefix, for example 'privacy.advertising-id.disable'. The file must be named <id>.json.",
      "type": "string",
      "pattern": "^[a-z][a-z0-9]*(?:\\.[a-z0-9]+(?:-[a-z0-9]+)*)+$"
    },
    "name": { "description": "Short human-readable name.", "type": "string", "minLength": 1 },
    "category": {
      "description": "Rule category. The rule file lives in Rules/<category>/.",
      "enum": [
        "Applications", "Startup", "Services", "ScheduledTasks", "Privacy", "Recommendations", "Features",
        "Gaming", "Explorer", "Search", "Networking", "Power", "Security", "Development", "ThirdParty"
      ]
    },
    "description": { "description": "Exactly what the rule changes, including the Windows setting it corresponds to.", "type": "string", "minLength": 1 },
    "rationale": { "description": "Why the change is worth making (its plausible optimization, privacy or usability value).", "type": "string", "minLength": 1 },
    "risk": {
      "description": "Low: normally safe. Medium: feature-dependent, needs a 'requirement.*' compatibility condition. High: may affect servicing, security or broad compatibility (also needs a 'requirement.*' condition).",
      "enum": ["Low", "Medium", "High"]
    },
    "reversible": { "description": "Whether WinLean can restore the previous state. Declarative resources are always reversible.", "type": "boolean" },
    "requiresReboot": { "description": "True exactly when takesEffect is 'Reboot'.", "type": "boolean" },
    "takesEffect": {
      "description": "The latest point at which the change is expected to be fully effective.",
      "enum": ["Immediately", "ExplorerRestart", "SignOut", "Reboot"]
    },
    "windows": {
      "description": "Supported Windows builds and editions.",
      "type": "object",
      "additionalProperties": false,
      "required": ["minBuild", "maxValidatedBuild"],
      "properties": {
        "minBuild": { "description": "Lowest supported build (22000 = Windows 11).", "type": "integer", "minimum": 22000 },
        "maxBuild": { "description": "Optional hard upper bound (the setting is known to be gone or changed after this build).", "type": ["integer", "null"], "minimum": 22000 },
        "maxValidatedBuild": { "description": "Newest build the rule was validated against. Newer builds require -AllowUntestedBuild.", "type": "integer", "minimum": 22000 },
        "editions": {
          "description": "Optional list of EditionID values (HKLM\\SOFTWARE\\Microsoft\\Windows NT\\CurrentVersion\\EditionID) the rule is effective on.",
          "type": "array",
          "minItems": 1,
          "items": { "type": "string", "pattern": "^[A-Za-z0-9]+$" }
        }
      }
    },
    "conditions": {
      "description": "All conditions must be true for the rule to apply. Unknown facts (for example undeclared requirements) skip the rule.",
      "type": "array",
      "items": {
        "type": "object",
        "additionalProperties": false,
        "required": ["fact", "operator", "value"],
        "properties": {
          "fact": {
            "description": "requirement.<key> (user compatibility requirement), capability.<key> (detected) or system.<key> (build, editionId, installationType, architecture, displayVersion).",
            "type": "string",
            "pattern": "^(?:requirement|capability|system)\\.[A-Za-z][A-Za-z0-9]*$"
          },
          "operator": { "enum": ["Equals", "NotEquals", "In", "NotIn", "GreaterOrEqual", "LessOrEqual"] },
          "value": { "description": "Boolean for requirements; array for In/NotIn; number for GreaterOrEqual/LessOrEqual." },
          "reason": { "description": "Shown in the plan when the condition is not met.", "type": "string", "minLength": 1 }
        }
      }
    },
    "dependencies": {
      "description": "Rules that must be applied (or already satisfied) first.",
      "type": "array",
      "items": { "type": "string", "pattern": "^[a-z][a-z0-9]*(?:\\.[a-z0-9]+(?:-[a-z0-9]+)*)+$" }
    },
    "conflicts": {
      "description": "Rules that must not be applied together with this rule.",
      "type": "array",
      "items": { "type": "string", "pattern": "^[a-z][a-z0-9]*(?:\\.[a-z0-9]+(?:-[a-z0-9]+)*)+$" }
    },
    "effects": { "description": "Expected effects.", "type": "array", "minItems": 1, "items": { "type": "string", "minLength": 1 } },
    "sideEffects": { "description": "Possible side effects (write 'None known' only after checking).", "type": "array", "minItems": 1, "items": { "type": "string", "minLength": 1 } },
    "notes": { "description": "Additional reviewer notes, for example the Windows default value.", "type": "array", "items": { "type": "string", "minLength": 1 } },
    "benefit": {
      "description": "What the rule is good for. Qualitative only: there are no numeric scores, and performance claims need a recorded measurement (see Docs/Rules.md).",
      "type": "object",
      "additionalProperties": false,
      "required": ["type", "value", "measurement"],
      "properties": {
        "type": {
          "description": "The primary benefit. Performance: measurable speed or responsiveness. BackgroundActivity: fewer processes, services, tasks or network activity. Privacy: less data collected or shared. Security: reduced exposure without disabling protections. Storage: disk space. Usability: a more convenient or transparent user interface. Distraction: fewer tips, suggestions and promotions.",
          "enum": ["Performance", "BackgroundActivity", "Privacy", "Security", "Storage", "Usability", "Distraction"]
        },
        "value": { "description": "Expected size of the benefit.", "enum": ["Cosmetic", "Low", "Moderate", "High"] },
        "measurement": { "description": "Measured: a recorded measurement shows the effect (requires measurementFile). NotMeasured: the benefit follows from the documented behaviour of the setting but was not measured. Performance, and Moderate/High BackgroundActivity, require Measured.", "enum": ["Measured", "NotMeasured"] },
        "measurementFile": { "description": "The measurement write-up (required when measurement is Measured).", "type": "string", "pattern": "^Docs/Measurements/[A-Za-z0-9][A-Za-z0-9._-]*\\.md$" }
      },
      "allOf": [
        {
          "if": { "properties": { "measurement": { "const": "Measured" } }, "required": ["measurement"] },
          "then": { "required": ["measurementFile"] },
          "else": { "not": { "required": ["measurementFile"] } }
        },
        {
          "if": { "properties": { "type": { "const": "Performance" } }, "required": ["type"] },
          "then": { "properties": { "measurement": { "const": "Measured" } } }
        },
        {
          "if": { "properties": { "type": { "const": "BackgroundActivity" }, "value": { "enum": ["Moderate", "High"] } }, "required": ["type", "value"] },
          "then": { "properties": { "measurement": { "const": "Measured" } } }
        }
      ]
    },
    "references": {
      "description": "Sources that document the exact setting (Microsoft documentation, ADMX policy definitions, Microsoft source code). May be empty only when 'evidence' records an observation.",
      "type": "array",
      "items": {
        "type": "object",
        "additionalProperties": false,
        "required": ["title", "url"],
        "properties": {
          "title": { "type": "string", "minLength": 1 },
          "url": { "type": "string", "pattern": "^https://" }
        }
      }
    },
    "evidence": {
      "description": "Recorded observations of what a Settings toggle writes, captured in a disposable VM (see Docs/Rules.md, evidence standard). Rules without a documentation reference may only change per-user preferences and are validated only up to the newest observed build.",
      "type": "array",
      "items": {
        "type": "object",
        "additionalProperties": false,
        "required": ["method", "build", "file", "summary"],
        "properties": {
          "method": { "description": "RegistryDiff (Tools/Capture-WinLeanEvidence.ps1) or ProcessMonitor (Sysinternals).", "enum": ["RegistryDiff", "ProcessMonitor"] },
          "build": { "description": "Windows build the observation was made on.", "type": "integer", "minimum": 22000 },
          "file": { "description": "The evidence write-up in the repository.", "type": "string", "pattern": "^Docs/Evidence/[A-Za-z0-9][A-Za-z0-9._-]*\\.md$" },
          "summary": { "description": "What was observed.", "type": "string", "minLength": 1 }
        }
      }
    },
    "validation": {
      "description": "How, on which Windows build and when the rule was validated. Optional for compatibility with older rule files, required for shipped rules. When present, windows.maxValidatedBuild must equal the newest build listed here.",
      "type": "array",
      "minItems": 1,
      "items": {
        "type": "object",
        "additionalProperties": false,
        "required": ["method", "build", "date"],
        "properties": {
          "method": { "description": "SourceReview: the setting was checked against its references or evidence on this build. VmApplyRestore: applied, verified and restored with WinLean in a disposable VM (Docs/VmValidation.md).", "enum": ["SourceReview", "VmApplyRestore"] },
          "build": { "description": "Windows build the validation was done on.", "type": "integer", "minimum": 22000 },
          "date": { "description": "Validation date (yyyy-MM-dd).", "type": "string", "pattern": "^\\d{4}-\\d{2}-\\d{2}$" },
          "file": { "description": "The validation record (required for VmApplyRestore).", "type": "string", "pattern": "^Docs/Validation/[A-Za-z0-9][A-Za-z0-9._-]*\\.md$" },
          "notes": { "type": "string", "minLength": 1 }
        },
        "if": { "properties": { "method": { "const": "VmApplyRestore" } }, "required": ["method"] },
        "then": { "required": ["file"] }
      }
    },
    "resources": {
      "description": "The declarative resources the rule manages. Apply, verify and undo are implemented by the resource provider.",
      "type": "array",
      "minItems": 1,
      "items": {
        "oneOf": [
          { "$ref": "#/definitions/registryValue" },
          { "$ref": "#/definitions/startupEntry" },
          { "$ref": "#/definitions/windowsOptionalFeature" }
        ]
      }
    },
    "tags": { "type": "array", "items": { "type": "string", "pattern": "^[a-z0-9]+(?:-[a-z0-9]+)*$" } }
  },
  "definitions": {
    "registryValue": {
      "type": "object",
      "additionalProperties": false,
      "required": ["type", "path", "name"],
      "properties": {
        "type": { "const": "RegistryValue" },
        "path": { "description": "Registry key, for example HKCU:\\Software\\Microsoft\\Windows\\CurrentVersion\\Explorer\\Advanced", "type": "string", "pattern": "^(?:HKCU|HKLM):\\\\.+" },
        "name": { "description": "Value name (the unnamed default value is not supported).", "type": "string", "minLength": 1 },
        "ensure": { "description": "Present (default) sets the value; Absent removes it.", "enum": ["Present", "Absent"] },
        "valueType": { "enum": ["String", "ExpandString", "MultiString", "DWord", "QWord", "Binary"] },
        "value": { "description": "DWord/QWord: integer; String/ExpandString: string; MultiString: array of strings; Binary: hex string." }
      },
      "if": { "properties": { "ensure": { "const": "Absent" } }, "required": ["ensure"] },
      "then": { "not": { "anyOf": [{ "required": ["valueType"] }, { "required": ["value"] }] } },
      "else": { "required": ["valueType", "value"] }
    },
    "startupEntry": {
      "description": "A program started at sign-in through a Run registry key. RunOnce keys and Startup folders are not supported; Task Manager's StartupApproved data is never modified.",
      "type": "object",
      "additionalProperties": false,
      "required": ["type", "location", "name", "ensure"],
      "properties": {
        "type": { "const": "StartupEntry" },
        "location": {
          "description": "CurrentUserRun (HKCU\\...\\Run), MachineRun (HKLM\\...\\Run) or MachineRun32 (HKLM\\SOFTWARE\\WOW6432Node\\...\\Run).",
          "enum": ["CurrentUserRun", "MachineRun", "MachineRun32"]
        },
        "name": { "description": "Name of the Run value.", "type": "string", "minLength": 1, "pattern": "\\S" },
        "ensure": { "description": "Absent removes the entry; Present adds or replaces it (needs risk Medium or higher).", "enum": ["Present", "Absent"] },
        "command": { "description": "The command line (Present only).", "type": "string", "minLength": 1 },
        "valueType": { "description": "Registry kind of the command (Present only; default String).", "enum": ["String", "ExpandString"] }
      },
      "if": { "properties": { "ensure": { "const": "Absent" } }, "required": ["ensure"] },
      "then": { "not": { "anyOf": [{ "required": ["command"] }, { "required": ["valueType"] }] } },
      "else": { "required": ["command"] }
    },
    "windowsOptionalFeature": {
      "description": "A Windows optional feature, changed through DISM (never through servicing registry keys). Rules need risk Medium or higher and takesEffect Reboot; disabling a feature that a compatibility requirement depends on needs the matching 'requirement.<key> Equals false' condition.",
      "type": "object",
      "additionalProperties": false,
      "required": ["type", "name", "state"],
      "properties": {
        "type": { "const": "WindowsOptionalFeature" },
        "name": { "description": "Exact feature name as shown by Get-WindowsOptionalFeature, for example 'TelnetClient'.", "type": "string", "pattern": "^[A-Za-z0-9][A-Za-z0-9._-]*$" },
        "state": { "description": "Enabled or Disabled. Removing feature payloads is not supported.", "enum": ["Enabled", "Disabled"] }
      }
    }
  }
}
